{
  "schema_version": 1,
  "id": "d59fxydfgn41",
  "type": "work",
  "title": "糞心錄",
  "authors": [
    {
      "name": "史夢蘭",
      "role": "輯",
      "entity_id": "hixhd2h9bcj7",
      "dynasty": "清",
      "source": {
        "name": "中國古籍總目",
        "type": "url",
        "details": "http://data.library.sh.cn/entity/person/fdtechwa6h4mbmre"
      }
    }
  ],
  "dynasty": "清",
  "dynasty_basis": "author_propagation",
  "period": "qing",
  "period_basis": "據 authors[0].dynasty「清」",
  "indexed_by": [
    {
      "source": "中國古籍總目",
      "source_bid": "1exjosng9241s",
      "title_info": "糞心錄不分卷",
      "author_info": "清史夢蘭輯",
      "section": "子部/雜家類/雜纂之屬",
      "summary": "共 1 個版本：稿本（國家圖書館）"
    }
  ],
  "ai_note": "G 道（overview#576）據《中國古籍總目》（上圖聯合目錄）自動錄入；匹配檔=新；源記錄：l60dt4i70llcqgue\n全版本無撰／著／作，Work.authors 取編／輯／纂／選之責任者\nE6 第 431 批新建（hold 清零：E；原 hold 原因：-）",
  "revision": "1.0.0",
  "revised_at": "2026-10-18"
}
