{
  "schema_version": 1,
  "id": "d59f2go9ojcx",
  "type": "work",
  "title": "雙溪醉隱集",
  "authors": [
    {
      "name": "耶律鑄",
      "role": "撰",
      "dynasty": "元",
      "entity_id": "hixhd2h9bfic"
    }
  ],
  "indexed_by": [
    {
      "source": "欽定四庫全書總目",
      "source_bid": "d59dh3vo9af4",
      "title_info": "《雙溪醉隱集》•八卷",
      "author_info": "元耶律鑄撰",
      "summary": "元耶律鑄撰。鑄字成仲，遼東丹王九世孫，中書令楚材之子也。累官中書左丞相。卒，追贈懿甯王，諡文忠。事蹟具《元史》本傳。楚材佐元太祖、太宗平定天下，立綱陳紀，皆出其所規畫。鑄少而聰敏，尤工騎射。從憲宗征蜀，屢建功績。後三入中書，定法令，制雅樂，多所裨贊。經濟不愧其父，而文章亦具有父風，故元好問、李冶諸人皆與款契。然楚材《湛然居士集》尚有抄本，而鑄集久佚不傳，藏書家至不能舉其名氏。惟明錢溥《內閣書目》有《耶律丞相雙溪集》十九冊，亦不詳其卷目。檢勘《永樂大典》所收鑄《雙溪醉隱集》，篇什較夥，有《前集》、《新集》、《續集》、《別集》、《外集》諸名。又別載趙著、麻革、王萬慶諸序跋，乃為鑄年少之詩，名《雙溪小稿》者而作。是所作諸集，本各為卷帙，頗有瑣碎之嫌。謹裒集編次，都為一集，而仍以《雙溪小稿》原序、原跋分系首末，用存其概。鑄早從征伐，足跡涉曆，多西北極遠之區，故所述塞外地理典故，往往詳核。如據《和林城唐明皇禦書闕特勤碑》證《新舊唐書》作“特勒”之誤。處月、丁零二注，辨論頗詳。此類皆有裨於考證。又其家在金、元之間，累世貴顯，諳習朝廷舊聞。集中如《瓊林園》、《龍和宮》諸賦，敍述海陵、章宗軼事及宮室制度，多《金史》所未及。其他題詠，亦多關係燕都故實，而《帝京景物略》諸書均未紀錄，亦足以資博識也。至於《金史•耶律履傳》、《元史•耶律楚材傳》均不著其裏貫，於史例頗為不合。今考鑄《寓曆亭詩注》雲：“予家遼上，後家醫無閭。”又《五湖別業詩注》雲：“余先居和林，從寓隗台，今卜築縉雲五湖別業。”敘其遷徙之跡頗詳，是尤足以補史之闕矣。",
      "edition": "永樂大典本"
    },
    {
      "source": "補遼金元藝文志",
      "source_bid": "d59f2mp1zsox",
      "title_info": "《雙溪醉隱集》八卷",
      "author_info": "楚材子",
      "summary": "元耶律鑄（楚材子）雙溪醉隱集八卷"
    },
    {
      "source": "元史藝文志",
      "source_bid": "d59f2mp1zsoz",
      "title_info": "《雙溪醉隱集》八卷",
      "summary": "元耶律鑄雙溪醉隱集八卷"
    },
    {
      "source": "清史稿藝文志",
      "source_bid": "d59f2mp0flz4",
      "title_info": "耶律鑄雙溪醉隱集",
      "summary": "耶律鑄雙溪醉隱集八卷。"
    },
    {
      "source": "中國古籍總目",
      "source_bid": "d59frnrt4lxc",
      "title_info": "雙溪醉隱集六卷",
      "author_info": "元耶律鑄撰",
      "section": "集部/別集類/金元之屬",
      "summary": "共 7 個版本：清錢塘丁氏八千卷樓抄本（南京圖書館）；清抄本（國家圖書館、上海圖書館）；抄本（國家圖書館）；清乾隆四十九年吳長元家抄本（國家圖書館）；清光緒間李文田抄本（國家圖書館）；清乾隆間翰林院紅格抄本（國家圖書館）；四庫全書本（馆藏未载）"
    }
  ],
  "juan_count": {
    "number": 8
  },
  "resources": [
    {
      "id": "wikisource",
      "name": "维基文库",
      "url": "https://zh.wikisource.org/wiki/雙溪醉隱集",
      "types": [
        "text"
      ]
    },
    {
      "id": "shidianguji-sikuquanshuben",
      "name": "识典古籍",
      "url": "https://www.shidianguji.com/book/SK2748",
      "metadata": {
        "edition": "四庫全書本",
        "version": "v7",
        "total_page": 535,
        "paragraph_count": 1617,
        "has_translation": true,
        "check_type": "粗校"
      },
      "types": [
        "text",
        "image"
      ]
    },
    {
      "id": "shidianguji-shundelongshiqinggua",
      "name": "识典古籍",
      "url": "https://www.shidianguji.com/book/NGJ892411999030995148991",
      "metadata": {
        "edition": "順德龍氏清光緒18年刻本",
        "version": "v1",
        "total_page": 338,
        "paragraph_count": 4550,
        "check_type": "AI整理"
      },
      "types": [
        "text",
        "image"
      ]
    },
    {
      "id": "shidianguji-liwentianjiaqingguan",
      "name": "识典古籍",
      "url": "https://www.shidianguji.com/book/NGJ892411999030993149131",
      "metadata": {
        "edition": "李文田家清光緒抄本",
        "version": "v1",
        "total_page": 444,
        "paragraph_count": 2726,
        "check_type": "AI整理"
      },
      "types": [
        "text",
        "image"
      ]
    },
    {
      "name": "Internet Archive",
      "id": "internet-archive",
      "url": "https://archive.org/details/06048833.cn",
      "types": [
        "image"
      ]
    },
    {
      "id": "commons",
      "name": "维基共享资源",
      "url": "https://commons.wikimedia.org/wiki/File:NLC892-411999030995-148991_%E9%9B%99%E6%BA%AA%E9%86%89%E9%9A%B1%E9%9B%86.pdf",
      "types": [
        "image"
      ],
      "root_type": "catalog",
      "metadata": {
        "format": "PDF",
        "edition": "刻本 知服齋叢書朱印本",
        "year": "順德龍氏清光緒18年[1892]",
        "note": "本链接为扫描册 1；不代表全书齐备。"
      }
    },
    {
      "id": "nlc",
      "group": "nlc-411999012022",
      "group_role": "origin",
      "name": "中華古籍資源庫（國家圖書館）",
      "short_name": "國圖",
      "url": "http://read.nlc.cn/allSearch/searchDetail?searchType=10024&showType=1&indexName=data_892&fid=411999012022",
      "types": [
        "image"
      ],
      "metadata": {
        "nlc_fid": "411999012022",
        "edition": "翰林院   清乾隆[1736-1795]"
      }
    },
    {
      "id": "nlc",
      "group": "nlc-411999030993",
      "group_role": "origin",
      "name": "中華古籍資源庫（國家圖書館）",
      "short_name": "國圖",
      "url": "http://read.nlc.cn/allSearch/searchDetail?searchType=10024&showType=1&indexName=data_892&fid=411999030993",
      "types": [
        "image"
      ],
      "metadata": {
        "nlc_fid": "411999030993",
        "edition": "清光緒[1875-1908]"
      }
    },
    {
      "id": "nlc",
      "group": "nlc-411999030995",
      "group_role": "origin",
      "name": "中華古籍資源庫（國家圖書館）",
      "short_name": "國圖",
      "url": "http://read.nlc.cn/allSearch/searchDetail?searchType=10024&showType=1&indexName=data_892&fid=411999030995",
      "types": [
        "image"
      ],
      "metadata": {
        "nlc_fid": "411999030995",
        "edition": "清光緒18年[1892]"
      }
    },
    {
      "id": "nlc",
      "group": "nlc-412000005867",
      "group_role": "origin",
      "name": "中華古籍資源庫（國家圖書館）",
      "short_name": "國圖",
      "url": "http://read.nlc.cn/allSearch/searchDetail?searchType=10024&showType=1&indexName=data_892&fid=412000005867",
      "types": [
        "image"
      ],
      "metadata": {
        "nlc_fid": "412000005867",
        "edition": "[出版年不詳]"
      }
    },
    {
      "id": "nlc",
      "group": "nlc-411999015219",
      "group_role": "origin",
      "name": "中華古籍資源庫（國家圖書館）",
      "short_name": "國圖",
      "url": "http://read.nlc.cn/allSearch/searchDetail?searchType=10024&showType=1&indexName=data_892&fid=411999015219",
      "types": [
        "image"
      ],
      "metadata": {
        "nlc_fid": "411999015219",
        "edition": "清乾隆49年[1784]"
      }
    },
    {
      "id": "nlc",
      "group": "nlc-411999002894",
      "group_role": "origin",
      "name": "中華古籍資源庫（國家圖書館）",
      "short_name": "國圖",
      "url": "http://read.nlc.cn/allSearch/searchDetail?searchType=10024&showType=1&indexName=data_892&fid=411999002894",
      "types": [
        "image"
      ],
      "metadata": {
        "nlc_fid": "411999002894",
        "edition": "清[1644-1911]"
      }
    }
  ],
  "measures": [
    {
      "unit": "卷",
      "number": 8
    }
  ],
  "measure_info": "八卷",
  "updated_at": "2026-08-09T09:33:12+00:00",
  "period": "liao-jin-yuan",
  "period_basis": "據 authors[0].dynasty「元」",
  "merged_in": [
    {
      "id": "1evr5e3mdqr7m",
      "title": "耶律鑄雙溪醉隱集",
      "author": "耶律鑄",
      "title_info": "耶律鑄雙溪醉隱集",
      "indexed_by_moved": [
        "清史稿藝文志"
      ]
    }
  ],
  "ai_note": "合併：題名「耶律鑄雙溪醉隱集」撰人折入題首（來源：清史稿藝文志），與本條同書（撰人「耶律鑄」已見本條 authors[]），裸題「雙溪醉隱集」全庫僅此一見，無同名之異書，逕併——撰人字首式重出候選（2026-08-07 深查，經人核可批次處理）。 [ljy-round1: dynasty null→元; 據 author.dynasty 集合補「元」] 2026-08-21 文淵閣四庫本雙錄歸併：所掛 Book 11qkhxkmw7f9c 與 11q37tkgycge8 同指文淵閣寫本一實物，今併於後者。\n\n2026-08-24 J11 description 撮自本條所繫之著錄：本欄之文由撰人、卷數、著錄諸志、志按所稱之佚文出處與輯家、存佚五節綴成，**每節皆據本條 indexed_by 之引文，不出其外，亦不臆造**。凡著錄所無者一字不書。此即 curate-dynasty S3〈借力志書〉之法——本時段有姚振宗《三國藝文志》與丁國鈞《補晉書藝文志》二部斷代志之整理本在庫，其按語備載卷數異同、佚文出處與輯家，正可為佚書之 desc 所本。**未覆核原書**。",
  "dynasty": "元",
  "dynasty_basis": "author_propagation",
  "description": {
    "text": "耶律鑄（元）撰。八卷。見著錄於《欽定四庫全書總目》《補遼金元藝文志》《元史藝文志》《清史稿藝文志》。諸志按語言其亡佚。其著錄之文，《補遼金元藝文志》作「元耶律鑄（楚材子）雙溪醉隱集八卷」。別集之屬，所收為其人之詩文。",
    "sources": [
      "欽定四庫全書總目",
      "補遼金元藝文志",
      "元史藝文志",
      "清史稿藝文志"
    ]
  },
  "revision": "1.1.0",
  "revised_at": "2026-10-07",
  "resource_groups": {
    "nlc-411999012022": {
      "label": "國圖藏本：翰林院   清乾隆[1736-1795]"
    },
    "nlc-411999030993": {
      "label": "國圖藏本：清光緒[1875-1908]"
    },
    "nlc-411999030995": {
      "label": "國圖藏本：清光緒18年[1892]"
    },
    "nlc-412000005867": {
      "label": "國圖藏本：[出版年不詳]"
    },
    "nlc-411999015219": {
      "label": "國圖藏本：清乾隆49年[1784]"
    },
    "nlc-411999002894": {
      "label": "國圖藏本：清[1644-1911]"
    }
  }
}
