{
  "schema_version": 1,
  "id": "d59fyyl7iy9s",
  "type": "work",
  "title": "太平清調迦陵音",
  "authors": [],
  "indexed_by": [
    {
      "source": "中國古籍總目",
      "source_bid": "1exjosng9241s",
      "title_info": "太平清調迦陵音一卷指迷十六觀一卷",
      "author_info": "",
      "section": "叢書部/獨撰類/明代",
      "summary": "共 1 個版本：（國家圖書館）"
    }
  ],
  "ai_note": "【叢書子目新建·未比对到单行本】叢書线（GUJI-526）：叢書子目新建，未比对到单行本（已按題名＋作者＋朝代全局预查）；所屬叢書記錄 vbtehv6lehq1e6va（刻金粟頭陀青蓮露六牋）\n叢書线（GUJI-526）據《中國古籍總目》（上圖聯合目錄）自動錄入；匹配檔=新；源記錄：nw4tdyl5c0h0pinw\nauto-split:存疑未并\n叢書子目，作者缺（同题既有 Work 作者缺，未硬并）",
  "revision": "1.0.0",
  "revised_at": "2026-10-20"
}
