{
  "schema_version": 1,
  "id": "d59fseu7n6rn",
  "type": "work",
  "title": "王太史季孺詩草",
  "authors": [
    {
      "name": "王荁",
      "role": "撰",
      "dynasty": "明",
      "source": {
        "name": "中國古籍總目",
        "type": "url",
        "details": "http://data.library.sh.cn/entity/person/zwnq0bm426stkreh"
      },
      "entity_id": "hixhd2h9bge5"
    }
  ],
  "dynasty": "明",
  "dynasty_basis": "author_propagation",
  "period": "ming",
  "period_basis": "據 authors[0].dynasty「明」",
  "indexed_by": [
    {
      "source": "中國古籍總目",
      "source_bid": "d59frnrt4lxc",
      "title_info": "王太史季孺詩草一卷",
      "author_info": "明王荁撰",
      "section": "集部/別集類/明代之屬",
      "summary": "共 1 個版本：明萬曆十七年屠本畯刻本（國家圖書館）"
    }
  ],
  "ai_note": "E 道（overview#409）據《中國古籍總目》（上圖聯合目錄）自動錄入；匹配檔=新；源記錄：d41k2rmhi3hcilyn",
  "revision": "1.0.0",
  "revised_at": "2026-10-09"
}
