{
  "schema_version": 1,
  "id": "d59fxygprim8",
  "type": "work",
  "title": "書經蔡傳",
  "authors": [
    {
      "name": "蔡沈",
      "role": "撰",
      "dynasty": "宋",
      "source": {
        "name": "中國古籍總目",
        "type": "url",
        "details": "http://data.library.sh.cn/entity/person/85usp1p7nv4of4o8"
      }
    }
  ],
  "dynasty": "宋",
  "dynasty_basis": "author_propagation",
  "period": "song",
  "period_basis": "據 authors[0].dynasty「宋」",
  "indexed_by": [
    {
      "source": "中國古籍總目",
      "source_bid": "1exjosng9241s",
      "title_info": "書經蔡傳六卷",
      "author_info": "宋蔡沈撰;清孫慶甲校述",
      "section": "經部/書類/傳說之屬",
      "summary": "共 1 個版本：清光緒十八年善化書局刻本（湖北省圖書館）"
    }
  ],
  "ai_note": "F 道（overview#576）據《中國古籍總目》（上圖聯合目錄）自動錄入；匹配檔=新；源記錄：5fppkosasl01lebg\nauto-split:存疑未并\nE6 第 530 批新建（hold 清零：jyiyi；原 hold 原因：）",
  "revision": "1.0.0",
  "revised_at": "2026-10-18"
}
