{
  "schema_version": 1,
  "id": "d59fyzax1jb4",
  "type": "work",
  "title": "水府諸神祀典記",
  "authors": [],
  "indexed_by": [
    {
      "source": "中國古籍總目",
      "source_bid": "1exjosng9241s",
      "title_info": "水府諸神祀典記一卷",
      "author_info": "",
      "section": "叢書部/獨撰類/民國以來",
      "summary": "共 1 個版本：（南京圖書館、山東省圖書館、天津圖書館、復旦大學圖書館、中國科學院圖書館、湖北省圖書館、上海圖書館、遼寧省圖書館、國家圖書館、雲南省圖書館）"
    }
  ],
  "ai_note": "【叢書子目新建·未比对到单行本】叢書线（GUJI-526）：叢書子目新建，未比对到单行本（已按題名＋作者＋朝代全局预查）；所屬叢書記錄 accti07eaaaxc8xd（周慤慎公全集十種）\n叢書线（GUJI-526）據《中國古籍總目》（上圖聯合目錄）自動錄入；匹配檔=新；源記錄：8mrt1cv3tfcqqrmr\nauto-split:存疑未并\n叢書子目，作者缺（同题既有 Work 作者缺，未硬并）",
  "revision": "1.0.0",
  "revised_at": "2026-10-20"
}
