{
  "schema_version": 1,
  "type": "work",
  "title": "易上下繫辭注",
  "period": "nanbeichao",
  "period_basis": "2026-09-05 《補南北史藝文志》整理：《補南北史藝文志》著錄，本志繫北齊代（550-577）。",
  "indexed_by": [
    {
      "source": "補南北史藝文志",
      "source_bid": "d59f2ofyy29s",
      "title_info": "易上下繫辭注",
      "summary": "見本傳。《齊書》同。；《隋·經籍志》未收。；按《北史》弼傳：“注《莊子·惠施篇》，並《易》上下《繫辭篇》，名曰《新注義苑》。”此注即《義苑》之一。",
      "author_info": "本志繫北齊代，見甲、經·易"
    }
  ],
  "ai_note": "2026-09-05 《補南北史藝文志》整理：據《補南北史藝文志》（徐崇撰）新建。本志繫北齊代，原文「杜弼　易上下繫辭注」。新建之由：庫中無同題（時代相容者），當新建。",
  "dynasty": "北齊",
  "authors": [
    {
      "name": "杜弼",
      "role": "撰",
      "dynasty": "北齊",
      "entity_id": "hixhd2h9brcb"
    }
  ],
  "id": "d59f9c149m2t",
  "revision": "1.0.0",
  "revised_at": "2026-09-05"
}
