{
  "schema_version": 1,
  "id": "d59fxur2mww1",
  "type": "work",
  "title": "光緒十四年戊子科江南鄉試硃卷",
  "authors": [
    {
      "name": "趙元益",
      "role": "撰",
      "dynasty": "清",
      "source": {
        "name": "中國古籍總目",
        "type": "url",
        "details": "http://data.library.sh.cn/entity/person/kfv3syftvyu3qnrt"
      }
    }
  ],
  "dynasty": "清",
  "dynasty_basis": "author_propagation",
  "period": "qing",
  "period_basis": "據 authors[0].dynasty「清」",
  "indexed_by": [
    {
      "source": "中國古籍總目",
      "source_bid": "1exjosng9241s",
      "title_info": "光緒十四年戊子科江南鄉試硃卷一卷",
      "author_info": "清趙元益撰",
      "section": "史部/傳記類/科舉錄之屬",
      "summary": "共 1 個版本：清光緒間刻本（上海圖書館）"
    }
  ],
  "ai_note": "F 道（overview#576）據《中國古籍總目》（上圖聯合目錄）自動錄入；匹配檔=新；源記錄：hf0n3ljml4wukq83",
  "revision": "1.0.0",
  "revised_at": "2026-10-18"
}
