{
  "schema_version": 1,
  "id": "d59fxoxajeo2",
  "type": "work",
  "title": "海上名妓四大金剛奇書",
  "authors": [
    {
      "name": "佚名",
      "role": "撰",
      "dynasty": ""
    }
  ],
  "indexed_by": [
    {
      "source": "中國古籍總目",
      "source_bid": "1exjosng9241s",
      "title_info": "海上名妓四大金剛奇書四卷五十回",
      "author_info": "清抽絲主人撰",
      "section": "子部/小說類/白話之屬/長篇",
      "summary": "共 1 個版本：清光緒二十五年上海石印書局石印本（北京大學圖書館）"
    }
  ],
  "ai_note": "G 道（overview#576）據《中國古籍總目》（上圖聯合目錄）自動錄入；匹配檔=新；源記錄：ei8rstfnhmkdw5e7\n主責任者「佚名」朝代在各版本／contMap 與題名行之間不一致，未寫 dynasty／period\n無主責任者（無名氏／責任者名被切斷／僅編校等次要角色），authors 記為佚名；原始責任者串：清抽絲主人撰\nE6 第 4 批新建（hold 清零：子部E机械落地b3:D-N-anon-clean；原 hold 原因：）",
  "revision": "1.0.0",
  "revised_at": "2026-10-18"
}
