{
  "schema_version": 1,
  "type": "work",
  "title": "公羊傳佚文",
  "id": "d59f2pr2j7cx",
  "loss_status": "partially_extant",
  "juan_count": {
    "number": 1
  },
  "measure_info": "一卷",
  "ai_note": "本 work 據《玉函山房輯佚書》目錄（光緒九年長沙嫏嬛館補校刊本）新建——該叢書續編十三經漢注著錄「公羊傳佚文一卷」，而本庫先前無同題之 work。所記止於目錄所有（題、卷數、撰人、朝代），撰人未繫 entity——目錄只給人名，繫人須另考。loss_status 記為 lost：馬氏既為之輯，其書清時已佚。本書之輯佚著錄見同目錄下 fragments/。\n\n2026-08-21 存佚判準訂正（SCHEMA〈loss_status 枚舉〉2026-08-21 訂正）：loss_status 由 lost 改為 partially_extant。本條有輯佚檔（輯家 1 家、已錄佚文 0 條、諸家所稱 0 條），是本書之文確有存世者。舊判準以「後人之輯本不改其為全佚」列為 lost，與本欄所宣之軸「本書之文今日尚存幾何」不自洽，今改。傳本斷絕之事由本條輯佚檔之存在承載，不因此喪失。\n\n2026-08-24 補著錄源：《玉函山房輯佚書》一節補入 indexed_by。本書（清馬國翰輯，光緒九年長沙嫏嬛館補校刊本）逐書著錄書名、卷數、撰人並各繫序錄，合 SCHEMA〈IndexEntry〉「本書被目錄書／志書著錄」之義，與《續修四庫全書》《清史稿·藝文志》輯佚子目同性質。舊只記於本書之輯佚檔 collectors 與整理本節，不入 indexed_by，致所繫千餘條顯為「無著錄源」。今補。（本節之 summary 現止於目錄層——馬氏每書之序錄尚未錄入整理本，俟序錄錄入後可回填。）\n\n2026-08-25 無斷代批次收尾（坑32）：本條所繫著錄止於題與卷數，不著撰人，故 authors 明寫空陣列——空陣列即「已考而無撰人」，與「缺鍵＝未考／未填」相別（SCHEMA〈無撰人 Work 非缺陷〉，全庫兩萬七千餘條無撰人，志書體例本不著）。**此謂「本條之著錄不著撰人」，非謂其書必無撰人可考**——他日若得他源之證（本傳、提要、輯本序之屬），仍當補之。",
  "updated_at": "2026-08-05T14:30:25+00:00",
  "period_upper": "qing",
  "period_upper_basis": "collection_bound：本書收入《玉函山房輯佚書》——馬國翰（1794–1857）所輯，其所輯之書必在咸豐以前，故不晚於 qing",
  "indexed_by": [
    {
      "source": "玉函山房輯佚書",
      "source_bid": "d59f2mua7w8y",
      "title_info": "公羊傳佚文一卷",
      "summary": "公羊傳佚文一卷　第None帙，卷None",
      "section": "補編·子編／十三經漢注",
      "juan_count": "1卷"
    }
  ],
  "authors": [],
  "revision": "1.0.0",
  "revised_at": "2026-08-25",
  "related_works": [
    {
      "id": "d59fxx8fbbwi",
      "relation": "related",
      "note": "總目經部另立（auto-split:同名无主责任者未并）"
    }
  ]
}
