{
  "schema_version": 1,
  "id": "d59fxs5d97nm",
  "type": "work",
  "title": "周易賸義",
  "authors": [
    {
      "name": "蔣本",
      "role": "撰",
      "dynasty": "清",
      "source": {
        "name": "中國古籍總目",
        "type": "url",
        "details": "http://data.library.sh.cn/gj/entity/person/0h0xhpf76rbv7b3t"
      }
    }
  ],
  "dynasty": "清",
  "dynasty_basis": "author_propagation",
  "period": "qing",
  "period_basis": "據 authors[0].dynasty「清」",
  "indexed_by": [
    {
      "source": "中國古籍總目",
      "source_bid": "1exjosng9241s",
      "title_info": "周易賸義不分卷",
      "author_info": "清蔣本撰",
      "section": "經部/易類/傳說之屬",
      "summary": "共 1 個版本：清道光十年檇李王氏信芳閣木活字印本（山東省圖書館、中國科學院圖書館、北京大學圖書館、南京圖書館、浙江圖書館、湖北省圖書館、上海圖書館、國家圖書館、天津圖書館、遼寧省圖書館）"
    }
  ],
  "ai_note": "F 道（overview#576）據《中國古籍總目》（上圖聯合目錄）自動錄入；匹配檔=新；源記錄：abq08ng4vfrzjpck\nE6 第 301 批新建（hold 清零：G527-M-new；原 hold 原因：-）",
  "revision": "1.0.0",
  "revised_at": "2026-10-18"
}
