{
  "schema_version": 1,
  "id": "d59fryc5h9tz",
  "type": "work",
  "title": "西虹漁唱",
  "authors": [
    {
      "name": "蔡春雷",
      "role": "撰",
      "dynasty": "清",
      "source": {
        "name": "中國古籍總目",
        "type": "url",
        "details": "http://data.library.sh.cn/entity/person/q3k6duwxn0ue4o2o"
      },
      "entity_id": "hixi5mk9gobd"
    }
  ],
  "dynasty": "清",
  "dynasty_basis": "author_propagation",
  "period": "qing",
  "period_basis": "據 authors[0].dynasty「清」",
  "indexed_by": [
    {
      "source": "中國古籍總目",
      "source_bid": "d59frnrt4lxc",
      "title_info": "西虹漁唱",
      "author_info": "清蔡春雷撰",
      "section": "集部/詞類/別集之屬",
      "summary": "共 1 個版本：清嘉慶十四年刻本（國家圖書館）"
    }
  ],
  "ai_note": "E 道（overview#409）據《中國古籍總目》（上圖聯合目錄）自動錄入；匹配檔=新；源記錄：0omozqec3erioiht",
  "revision": "1.0.0",
  "revised_at": "2026-10-08"
}
