{
  "schema_version": 1,
  "id": "d59fsdyq8idi",
  "type": "work",
  "title": "稷山樓文稿",
  "authors": [
    {
      "name": "陶浚宣",
      "role": "撰",
      "source": {
        "name": "中國古籍總目",
        "type": "url",
        "details": "http://data.library.sh.cn/entity/person/q1j667pbtzjqknxg"
      },
      "entity_id": "hixi5gdsdqmr"
    }
  ],
  "indexed_by": [
    {
      "source": "中國古籍總目",
      "source_bid": "d59frnrt4lxc",
      "title_info": "稷山樓文稿不分卷",
      "author_info": "清陶濬宣撰",
      "section": "集部/別集類/清代之屬/清後期",
      "summary": "共 1 個版本：稿本（浙江圖書館、北京大學圖書館）"
    }
  ],
  "ai_note": "E 道（overview#409）據《中國古籍總目》（上圖聯合目錄）自動錄入；匹配檔=新；源記錄：88gxma4enspzya5f\n主責任者「陶浚宣」朝代在各版本／contMap 與題名行之間不一致，未寫 dynasty／period",
  "revision": "1.0.0",
  "revised_at": "2026-10-09"
}
