{
  "schema_version": 1,
  "id": "d59fxrxee6td",
  "type": "work",
  "title": "輯硯瑣言",
  "authors": [
    {
      "name": "張在辛",
      "role": "撰",
      "dynasty": "清",
      "source": {
        "name": "中國古籍總目",
        "type": "url",
        "details": "http://data.library.sh.cn/entity/person/jqkm2hoikyu5qf8c"
      },
      "entity_id": "hixi5hm69jbw"
    }
  ],
  "dynasty": "清",
  "dynasty_basis": "author_propagation",
  "period": "qing",
  "period_basis": "據 authors[0].dynasty「清」",
  "indexed_by": [
    {
      "source": "中國古籍總目",
      "source_bid": "1exjosng9241s",
      "title_info": "輯硯瑣言一卷",
      "author_info": "清張在辛撰",
      "section": "子部/譜錄類/器用之屬/文房",
      "summary": "共 1 個版本：瑣言本（馆藏未载）"
    }
  ],
  "ai_note": "E 道（overview#409）據《中國古籍總目》（上圖聯合目錄）自動錄入；匹配檔=新；源記錄：lgaodc3se2bj5q4c",
  "revision": "1.0.0",
  "revised_at": "2026-10-18"
}
