{
  "schema_version": 1,
  "id": "d59fy3rrb6yo",
  "type": "work",
  "title": "書法粹言",
  "authors": [
    {
      "name": "汪挺",
      "role": "撰",
      "dynasty": "明",
      "source": {
        "name": "中國古籍總目",
        "type": "url",
        "details": "http://data.library.sh.cn/entity/person/5lpfls44hezy62wo"
      }
    }
  ],
  "dynasty": "明",
  "dynasty_basis": "author_propagation",
  "period": "ming",
  "period_basis": "據 authors[0].dynasty「明」",
  "indexed_by": [
    {
      "source": "中國古籍總目",
      "source_bid": "1exjosng9241s",
      "title_info": "書法粹言一卷",
      "author_info": "明汪挺撰",
      "section": "叢書部/雜纂類/清代前期",
      "summary": "共 1 個版本：（福建省圖書館、中國科學院圖書館、中山大學圖書館、國家圖書館、上海圖書館、重慶市圖書館、北京大學圖書館、中國社會科學院文學研究所）"
    },
    {
      "source": "中國古籍總目",
      "source_bid": "1exjosng9241s",
      "title_info": "書法粹言一卷",
      "author_info": "明汪挺撰",
      "section": "子部/藝術類/書畫之屬/書",
      "summary": "共 1 個版本：學海類編本（馆藏未载）"
    }
  ],
  "ai_note": "【叢書子目新建·未比对到单行本】叢書线（GUJI-526）：叢書子目新建，未比对到单行本（已按題名＋作者＋朝代全局预查）；所屬叢書記錄 6vdgzv8ybc7u7qgg（學海類編四百三十種）\n叢書线（GUJI-526）據《中國古籍總目》（上圖聯合目錄）自動錄入；匹配檔=新；源記錄：erpb7uzkydalqrwr\n子部四并条 A档 同題同作者（源 Work 1exp2tg5vs6wz《書法粹言》已並入；其作者寫法：汪挺）",
  "merged_in": [
    {
      "id": "1exp2tg5vs6wz",
      "title": "書法粹言",
      "at": "2026-10-18T04:01:26Z",
      "by": "子部四",
      "rule": "同題同作者並條（作者別名與並條口徑-共用 A／B 檔）",
      "why": "子部四并条 A档 同題同作者"
    }
  ],
  "revision": "1.0.0",
  "revised_at": "2026-10-18"
}
