{
  "schema_version": 1,
  "type": "work",
  "title": "謝安石僚屬名",
  "period": "jin",
  "period_basis": "2026-09-06 《補晉書藝文志》（文廷式）整理：《補晉書藝文志》（文廷式）著錄。晉（265-420）。",
  "indexed_by": [
    {
      "source": "補晉書藝文志（文廷式）",
      "source_bid": "d59f2o2m8hky",
      "title_info": "謝安石僚屬名",
      "summary": "謝安石僚屬名",
      "author_info": "見史部·職官類"
    }
  ],
  "ai_note": "2026-09-06 《補晉書藝文志》（文廷式）整理：據《補晉書藝文志》（徐崇撰）新建。原文「不著撰人　謝安石僚屬名」。新建之由：庫中無同題者。　原無撰人；謝安石為僚屬所隸，非撰人\n\n2026-09-06 晉志 source 正名：indexed_by.source 綴撰人以別五家補晉志（四本同題《補晉書藝文志》，非綴撰人不可辨）。source_bid 未動。",
  "dynasty": "晉",
  "id": "d59f9nmljojv",
  "revision": "1.0.0",
  "revised_at": "2026-09-06"
}
