{
  "schema_version": 1,
  "id": "d59fz6d0u6m8",
  "type": "work",
  "title": "釋二辨文",
  "authors": [],
  "indexed_by": [
    {
      "source": "中國古籍總目",
      "source_bid": "d59frnrt4lxc",
      "title_info": "釋二辨文一卷",
      "author_info": "",
      "section": "叢書部/獨撰類/清代前期",
      "summary": "共 1 個版本：（國家圖書館、北京大學圖書館、山東省圖書館、復旦大學圖書館、中共北京市委圖書館、中山大學圖書館、湖北省圖書館）"
    }
  ],
  "ai_note": "【叢書子目新建·未比对到单行本】叢書线（GUJI-526）：叢書子目新建，未比对到单行本（已按題名＋作者＋朝代全局预查）；所屬叢書記錄 ffavxtau5zk7vypt（西河合集一百十九種）\n叢書线（GUJI-526）據《中國古籍總目》（上圖聯合目錄）自動錄入；匹配檔=新；源記錄：245rra5e7kcc2g27\nauto-split:同题既有 Work 未并，待查重线处理",
  "revision": "1.0.0",
  "revised_at": "2026-10-20"
}
