{
  "schema_version": 1,
  "id": "d59fryr0t9fu",
  "type": "work",
  "title": "新鐫樂府爭奇",
  "authors": [
    {
      "name": "汪公亮",
      "role": "輯校",
      "entity_id": "hixi8u5ujjyj",
      "dynasty": "明",
      "source": {
        "name": "中國古籍總目",
        "type": "url",
        "details": "http://data.library.sh.cn/entity/person/sng7zehcz0g6i2cm"
      }
    }
  ],
  "dynasty": "明",
  "dynasty_basis": "author_propagation",
  "period": "ming",
  "period_basis": "據 authors[0].dynasty「明」",
  "indexed_by": [
    {
      "source": "中國古籍總目",
      "source_bid": "d59frnrt4lxc",
      "title_info": "新鐫樂府爭奇三卷",
      "author_info": "明汪公亮輯校",
      "section": "集部/曲類/曲選之屬",
      "summary": "共 1 個版本：明汪公亮刻本（國家圖書館）"
    }
  ],
  "ai_note": "E 道（overview#409）據《中國古籍總目》（上圖聯合目錄）自動錄入；匹配檔=新；源記錄：1olekjaa0jk78paq\n全版本無撰／著／作，Work.authors 取編／輯／纂／選之責任者",
  "revision": "1.0.0",
  "revised_at": "2026-10-08"
}
