{
  "schema_version": 1,
  "id": "d59fschc15aa",
  "type": "work",
  "title": "杜文貞公詩集",
  "authors": [
    {
      "name": "杜甫",
      "role": "撰",
      "dynasty": "唐",
      "source": {
        "name": "中國古籍總目",
        "type": "url",
        "details": "http://data.library.sh.cn/entity/person/o4a45qx7gh4kz25j"
      },
      "entity_id": "hixhd2h9bhkw"
    }
  ],
  "dynasty": "唐",
  "dynasty_basis": "author_propagation",
  "period": "sui-tang",
  "period_basis": "據 authors[0].dynasty「唐」",
  "indexed_by": [
    {
      "source": "中國古籍總目",
      "source_bid": "d59frnrt4lxc",
      "title_info": "杜文貞公詩集十八卷",
      "author_info": "唐杜甫撰;清陳光緒注",
      "section": "集部/別集類/唐五代之屬",
      "summary": "共 1 個版本：稿本（成都杜甫草堂）"
    }
  ],
  "ai_note": "E 道（overview#409）據《中國古籍總目》（上圖聯合目錄）自動錄入；匹配檔=新；源記錄：72hoc8eiw4str75o",
  "revision": "1.0.0",
  "revised_at": "2026-10-08"
}
