{
  "schema_version": 1,
  "id": "d59f2nu4mxvk",
  "type": "work",
  "title": "急救良方",
  "authors": [
    {
      "name": "余成甫",
      "role": "撰",
      "dynasty": "清",
      "entity_id": "hixhd2h9bjfm"
    }
  ],
  "juan_count": {
    "number": 1
  },
  "indexed_by": [
    {
      "source": "清史稿藝文志",
      "source_bid": "d59f2mp0flz4",
      "title_info": "急救良方",
      "summary": "急救良方一卷。余成甫撰。"
    }
  ],
  "measures": [
    {
      "unit": "卷",
      "number": 1
    }
  ],
  "measure_info": "一卷",
  "updated_at": "2026-08-09T10:40:18+00:00",
  "period": "qing",
  "period_basis": "據 authors[0].dynasty「清」",
  "dynasty": "清",
  "dynasty_basis": "qing_round1:period=qing 且非通用作者 dynasty 唯一为「清」",
  "description": {
    "text": "余成甫（清）撰。一卷。見著錄於《清史稿藝文志》。其著錄之文，《清史稿藝文志》作「急救良方一卷」。本書惟《清史稿藝文志》一志著錄，別無他證。《清史稿藝文志》民國趙爾巽等修——本書之目賴之以存。",
    "sources": [
      "清史稿藝文志"
    ]
  },
  "ai_note": "2026-08-24 J11 description 撮自本條所繫之著錄：本欄之文由撰人、卷數、著錄諸志、志按所稱之佚文出處與輯家、存佚五節綴成，**每節皆據本條 indexed_by 之引文，不出其外，亦不臆造**。凡著錄所無者一字不書。此即 curate-dynasty S3〈借力志書〉之法——本時段有姚振宗《三國藝文志》與丁國鈞《補晉書藝文志》二部斷代志之整理本在庫，其按語備載卷數異同、佚文出處與輯家，正可為佚書之 desc 所本。**未覆核原書**。",
  "revision": "1.0.0",
  "revised_at": "2026-08-25"
}
