{
  "schema_version": 1,
  "id": "d59fxr0cst1c",
  "type": "work",
  "title": "董妃行狀",
  "authors": [
    {
      "name": "愛新覺羅·福臨",
      "role": "撰",
      "dynasty": "清",
      "source": {
        "name": "中國古籍總目",
        "type": "url",
        "details": "http://data.library.sh.cn/entity/person/buvfur571w1u2vgk"
      }
    }
  ],
  "dynasty": "清",
  "dynasty_basis": "author_propagation",
  "period": "qing",
  "period_basis": "據 authors[0].dynasty「清」",
  "indexed_by": [
    {
      "source": "中國古籍總目",
      "source_bid": "1exjosng9241s",
      "title_info": "董妃行狀一卷",
      "author_info": "清世祖福臨撰",
      "section": "史部/傳記類/別傳之屬",
      "summary": "共 1 個版本：滿清野史續编本（馆藏未载）"
    }
  ],
  "ai_note": "F 道（overview#576）據《中國古籍總目》（上圖聯合目錄）自動錄入；匹配檔=新；源記錄：8g8len1vpcp5o6df",
  "revision": "1.0.0",
  "revised_at": "2026-10-18"
}
