{
  "schema_version": 1,
  "type": "work",
  "title": "黃帝出軍遯甲式",
  "juan_count": {
    "number": 1
  },
  "indexed_by": [
    {
      "source": "國史經籍志",
      "source_bid": "d59f2nl40936",
      "title_info": "《黄帝出軍遯甲式》一卷",
      "summary": "《黄帝出軍遯甲式》一卷"
    }
  ],
  "description": {
    "text": "《國史經籍志》收錄。",
    "sources": [
      "國史經籍志"
    ]
  },
  "id": "d59f2q7fv8qq",
  "measures": [
    {
      "unit": "卷",
      "number": 1
    }
  ],
  "measure_info": "一卷",
  "additional_titles": [
    "黄帝出軍遯甲式"
  ],
  "updated_at": "2026-05-18T00:03:58-07:00",
  "period_upper": "ming",
  "period_upper_basis": "catalog_bound：所繫諸志中最緊者為《國史經籍志》（明焦竑（1590）），故不晚於 ming",
  "authors": [],
  "ai_note": "2026-08-25 無斷代批次收尾（坑32）：本條所繫著錄止於題與卷數，不著撰人，故 authors 明寫空陣列——空陣列即「已考而無撰人」，與「缺鍵＝未考／未填」相別（SCHEMA〈無撰人 Work 非缺陷〉，全庫兩萬七千餘條無撰人，志書體例本不著）。**此謂「本條之著錄不著撰人」，非謂其書必無撰人可考**——他日若得他源之證（本傳、提要、輯本序之屬），仍當補之。",
  "revision": "1.0.0",
  "revised_at": "2026-08-25"
}
