{
  "schema_version": 1,
  "id": "d59f2ng559mo",
  "type": "work",
  "title": "李鄴侯傳",
  "authors": [
    {
      "name": "朱右",
      "role": "撰",
      "dynasty": "明",
      "entity_id": "1j967c147nuhq"
    }
  ],
  "juan_count": {
    "number": 2
  },
  "indexed_by": [
    {
      "source": "明史藝文志",
      "source_bid": "d59f2mox0000",
      "title_info": "朱右《李鄴侯传》二卷",
      "summary": "朱右《李鄴侯傳》二卷"
    }
  ],
  "description": {
    "text": "朱右（明）撰。二卷。見著錄於《明史藝文志》。其著錄之文，《明史藝文志》作「朱右《李鄴侯傳》二卷」。本書惟《明史藝文志》一志著錄，別無他證。《明史藝文志》清張廷玉等修——本書之目賴之以存。",
    "sources": [
      "明史藝文志"
    ]
  },
  "measures": [
    {
      "unit": "卷",
      "number": 2
    }
  ],
  "measure_info": "二卷",
  "updated_at": "2026-08-09T10:41:40+00:00",
  "period": "ming",
  "period_basis": "據 authors[0].dynasty「明」",
  "dynasty": "明",
  "dynasty_basis": "author_propagation",
  "ai_note": "[ming-round1: author.dynasty 集合=['明'] → dynasty=明]\n\n2026-08-24 J11 description 撮自本條所繫之著錄：本欄之文由撰人、卷數、著錄諸志、志按所稱之佚文出處與輯家、存佚五節綴成，**每節皆據本條 indexed_by 之引文，不出其外，亦不臆造**。凡著錄所無者一字不書。此即 curate-dynasty S3〈借力志書〉之法——本時段有姚振宗《三國藝文志》與丁國鈞《補晉書藝文志》二部斷代志之整理本在庫，其按語備載卷數異同、佚文出處與輯家，正可為佚書之 desc 所本。**未覆核原書**。",
  "revision": "1.0.0",
  "revised_at": "2026-08-25"
}
